Task,Start,Finish,Progress,Description
Week 1: Task 1,2024-09-04,2024-09-10,0,Define project objectives and scope. Finalize key deliverables and stakeholders. Create a project charter.
Week 1: Task 2,2024-09-04,2024-09-10,0,Conduct initial research on existing image analysis tools and technologies relevant to geoscience.
Week 2: Task 1,2024-09-11,2024-09-17,0,Brainstorm and ideate potential features and functionalities for the image analysis tool.
Week 2: Task 2,2024-09-11,2024-09-17,0,Create user personas and use cases to guide the tool's design and development.
Week 3: Task 1,2024-09-18,2024-09-24,0,Develop wireframes and mockups for the user interface. Gather feedback from potential users.
Week 3: Task 2,2024-09-18,2024-09-24,0,Select the appropriate technology stack and tools for the project's development phase.
Week 4: Task 1,2024-09-25,2024-10-01,0,"Set up the development environment, including version control and necessary software installations."
Week 4: Task 2,2024-09-25,2024-10-01,0,"Begin coding the basic structure of the image analysis tool, focusing on core functionality."
Week 5: Task 1,2024-10-02,2024-10-08,0,Continue development with a focus on implementing key features and ensuring functionality.
Week 5: Task 2,2024-10-02,2024-10-08,0,Conduct regular code reviews and testing to catch and fix bugs early in the development process.
Week 6: Task 1,2024-10-09,2024-10-15,0,Integrate any necessary APIs or external libraries. Ensure compatibility with the development environment.
Week 6: Task 2,2024-10-09,2024-10-15,0,Complete the initial version of the tool and prepare for alpha testing by the project team.
Week 7: Task 1,2024-10-16,2024-10-22,0,Conduct alpha testing with a small group of users. Gather feedback on usability and performance.
Week 7: Task 2,2024-10-16,2024-10-22,0,Refine and optimize the tool based on feedback. Focus on enhancing the user experience.
Week 8: Task 1,2024-10-23,2024-10-29,0,Prepare for beta testing by finalizing all core features and addressing any remaining issues.
Week 8: Task 2,2024-10-23,2024-10-29,0,Conduct beta testing with a broader group of users. Collect feedback and track any reported bugs.
Week 9: Task 1,2024-10-30,2024-11-05,0,Finalize the tool for deployment. Ensure all documentation is complete and ready for release.
Week 9: Task 2,2024-10-30,2024-11-05,0,Deploy the image analysis tool to the selected platform(s). Perform a final round of testing post-deployment.
Week 10: Task 1,2024-11-06,2024-11-12,0,Conduct a post-launch review. Analyze user feedback and tool performance metrics.
Week 10: Task 2,2024-11-06,2024-11-12,0,Document lessons learned and create a plan for future updates or iterations of the tool.
